{
  "decision": "approved",
  "remaining_escalations": [],
  "git_object_format": "sha1",
  "preflight_release_source_commit": "575eae9ffbe36357b947d66e63cb4043bec67b5f",
  "plan_sha256": "68615119bf70631d355c30a3348e06afd8c5ad242e2b5dd90e88b510bcbb57ab",
  "blueprint_sha256": "e411e4b432b9e2cbe67961bcbd1e7b845cf5cca0437359ee98a6547047abdbf8",
  "research_authority_sha256": "8dca1748a211b9eaf9df5d392d7d39d755cbe3946a358c11cff2f51c5323d91d",
  "review_schema_sha256": "366456558ebcccbd0b6e1d0746eabacd724dc2a3fe7f56d9b81fb7a751dca264",
  "contract_decisions_sha256": "7c597d65df504e92561abfeecadd9cfc8d378fecf40e9719e9f710c766fca9a8",
  "decision_contract_sha256": "4e0d08cb49cd75d6198cae9b06644dfae911526029fbce0f010c6b54f9d83931"
}
